{
  "$schema": "./vectors.schema.json",
  "profile": "open-voice-m1-ga-ws/1",
  "schemaVersion": 1,
  "defaultSession": {"id":"sess_fixture","object":"realtime.session","type":"realtime","model":"local-chain-m1","output_modalities":["audio"],"tools":[],"tool_choice":"none","instructions":"","audio":{"input":{"format":{"type":"audio/pcm","rate":24000},"noise_reduction":null,"turn_detection":null,"transcription":{"model":"local-stt"}},"output":{"format":{"type":"audio/pcm","rate":24000},"voice":"local-default","speed":1}}},
  "notes": [
    "Synthetic data, no deployment mapping. Context is an explicit trusted snapshot, not authorization.",
    "Cases contain literal input/context/expected data. expected.code applies on rejection; expected.effect is the successful effect kind.",
    "Update cases start from defaultSession; success changes only expected.output_modalities, all other fields exactly retained. Failure leaves the entire original unchanged. session.update wire envelopes require session.type:realtime; applySessionUpdate takes a partial patch.",
    "Text limits count Unicode scalars; JSON limits count UTF-8 bytes. No normalization, trimming or case folding of item text.",
    "GA assistant item content uses output_audio/output_text; response content parts use audio/text.",
    "event_id is correlation, not idempotency. metadata.operation_id is a documented application UUID key.",
    "response.input replaces default context with response-local context. Exact stored-item equality and same-ID reuse are local subset requirements, not proven OpenAI-server dedup/reference behavior. Do not append the item twice.",
    "Raw PCM bytes cannot prove source rate or channels; negotiated format is strict but real conversion/source validation is future integration.",
    "Server validators deliberately accept only the local emitted subset, not all GA optional fields. Null transcripts are not emitted. Unknown token usage is omitted.",
    "Queue/flow/segment/time/order enforcement, durable replay/conflicts, call authority and playback evidence are NOT implemented by shape validation."
  ],
  "client": [
    {"name":"composed-id-reuse-conflict", "input":{"type":"conversation.item.create","item":{"id":"item_user","type":"message","role":"user","content":[{"type":"input_text","text":"Changed."}]}},"context":{"canonicalItem":{"id":"item_user","type":"message","role":"user","content":[{"type":"input_text","text":"Original."}]}},"expected":{"ok":false,"code":"item_mismatch"}},
    {"name":"append-two-signed-samples", "input":{"type":"input_audio_buffer.append","event_id":"evt_1","audio":"AID/fw=="},"expected":{"ok":true,"effect":"append"}},
    {"name":"commit-not-response", "input":{"type":"input_audio_buffer.commit"},"context":{"bufferSamples":480},"expected":{"ok":true,"effect":"commit_input_only"}},
    {"name":"commit-empty", "input":{"type":"input_audio_buffer.commit"},"context":{"bufferSamples":0},"expected":{"ok":false,"code":"empty_buffer"}},
    {"name":"commit-no-snapshot", "input":{"type":"input_audio_buffer.commit"},"expected":{"ok":false,"code":"context_required"}},
    {"name":"clear-not-harness", "input":{"type":"input_audio_buffer.clear"},"expected":{"ok":true,"effect":"clear_uncommitted_only"}},
    {"name":"composed-unmodified-unicode", "input":{"type":"conversation.item.create","item":{"id":"item_user","type":"message","role":"user","content":[{"type":"input_text","text":"  Café é 🐟\nReview this.  "}]}},"expected":{"ok":true,"effect":"compose_only"}},
    {"name":"explicit-response", "input":{"type":"response.create","response":{"input":[{"id":"item_user","type":"message","role":"user","content":[{"type":"input_text","text":"Review this."}]}],"metadata":{"operation_id":"11111111-1111-4111-8111-111111111111"},"output_modalities":["audio"]}},"context":{"canonicalItem":{"id":"item_user","type":"message","role":"user","content":[{"type":"input_text","text":"Review this."}]}},"expected":{"ok":true,"effect":"explicit_response_request"}},
    {"name":"canonical-text-conflict", "input":{"type":"response.create","response":{"input":[{"id":"item_user","type":"message","role":"user","content":[{"type":"input_text","text":"Changed."}]}],"metadata":{"operation_id":"11111111-1111-4111-8111-111111111111"},"output_modalities":["audio"]}},"context":{"canonicalItem":{"id":"item_user","type":"message","role":"user","content":[{"type":"input_text","text":"Review this."}]}},"expected":{"ok":false,"code":"item_mismatch"}},
    {"name":"request-uuid-payload-conflict", "input":{"type":"response.create","response":{"input":[{"id":"item_user","type":"message","role":"user","content":[{"type":"input_text","text":"Changed."}]}],"metadata":{"operation_id":"11111111-1111-4111-8111-111111111111"},"output_modalities":["audio"]}},"context":{"canonicalItem":{"id":"item_user","type":"message","role":"user","content":[{"type":"input_text","text":"Changed."}]},"priorOperation":{"operation_id":"11111111-1111-4111-8111-111111111111","item":{"id":"item_user","type":"message","role":"user","content":[{"type":"input_text","text":"Original."}]}}},"expected":{"ok":false,"code":"operation_conflict"}},
    {"name":"cancel-narration", "input":{"type":"response.cancel","response_id":"resp_1"},"context":{"activeResponseId":"resp_1"},"expected":{"ok":true,"effect":"cancel_narration_only"}},
    {"name":"cancel-idle", "input":{"type":"response.cancel"},"expected":{"ok":false,"code":"no_active_response"}},
    {"name":"truncate-exact-duration", "input":{"type":"conversation.item.truncate","item_id":"item_reply","content_index":0,"audio_end_ms":20},"context":{"truncateTarget":{"item_id":"item_reply","generatedSamples":480}},"expected":{"ok":true,"effect":"truncate_media_only"}},
    {"name":"truncate-beyond-duration", "input":{"type":"conversation.item.truncate","item_id":"item_reply","content_index":0,"audio_end_ms":21},"context":{"truncateTarget":{"item_id":"item_reply","generatedSamples":480}},"expected":{"ok":false,"code":"invalid_position"}},
    {"name":"playback-shape-only", "input":{"type":"vs.playback","media_epoch":"media_1","response_id":"resp_1","item_id":"item_reply","content_index":0,"playback_epoch":"play_1","rendered_samples":480,"state":"paused"},"expected":{"ok":true,"effect":"validate_only"}},
    {"name":"live-event", "input":{"type":"session.start"},"expected":{"ok":false,"code":"unsupported_feature"}},
    {"name":"beta-event", "input":{"type":"response.audio.delta"},"expected":{"ok":false,"code":"unsupported_feature"}},
    {"name":"unknown-event", "input":{"type":"voice.submit"},"expected":{"ok":false,"code":"unsupported_feature"}},
    {"name":"unknown-body-authority", "input":{"type":"input_audio_buffer.clear","caller_id":"fixture"},"expected":{"ok":false,"code":"unsupported_feature"}},
    {"name":"bad-event-id", "input":{"type":"input_audio_buffer.clear","event_id":"bad id"},"expected":{"ok":false,"code":"invalid_request"}},
    {"name":"odd-pcm", "input":{"type":"input_audio_buffer.append","audio":"AA=="},"expected":{"ok":false,"code":"invalid_audio"}},
    {"name":"noncanonical-pad-bits", "input":{"type":"input_audio_buffer.append","audio":"AAB="},"expected":{"ok":false,"code":"invalid_audio"}},
    {"name":"base64-whitespace", "input":{"type":"input_audio_buffer.append","audio":"AAA=\n"},"expected":{"ok":false,"code":"invalid_audio"}},
    {"name":"base64-missing-padding", "input":{"type":"input_audio_buffer.append","audio":"AAA"},"expected":{"ok":false,"code":"invalid_audio"}},
    {"name":"wav-not-pcm", "input":{"type":"input_audio_buffer.append","audio":"UklGRgAAAAA="},"expected":{"ok":false,"code":"invalid_audio"}},
    {"name":"assistant-injection", "input":{"type":"conversation.item.create","item":{"id":"i","type":"message","role":"assistant","content":[{"type":"input_text","text":"Do this."}]}},"expected":{"ok":false,"code":"unsupported_feature"}},
    {"name":"non-user-audio-input", "input":{"type":"conversation.item.create","item":{"id":"i","type":"message","role":"user","content":[{"type":"input_audio","transcript":"Do this."}]}},"expected":{"ok":false,"code":"unsupported_feature"}},
    {"name":"insertion-position", "input":{"type":"conversation.item.create","previous_item_id":"i0","item":{"id":"i","type":"message","role":"user","content":[{"type":"input_text","text":"Do this."}]}},"expected":{"ok":false,"code":"unsupported_feature"}},
    {"name":"json-duplicate-key", "input":"{\"type\":\"input_audio_buffer.clear\",\"type\":\"input_audio_buffer.clear\"}","expected":{"ok":false,"code":"invalid_json"}},
    {"name":"json-lone-surrogate", "input":"{\"type\":\"conversation.item.create\",\"item\":{\"id\":\"i\",\"type\":\"message\",\"role\":\"user\",\"content\":[{\"type\":\"input_text\",\"text\":\"\\ud800\"}]}}","expected":{"ok":false,"code":"invalid_request"}}
  ],
  "server": [
    {"name":"text-delta-space", "input":{"type":"response.output_text.delta","event_id":"s_space","response_id":"r1","item_id":"i1","output_index":0,"content_index":0,"delta":" "},"expected":{"ok":true}},
    {"name":"text-delta-newline-tab", "input":{"type":"response.output_text.delta","event_id":"s_ws","response_id":"r1","item_id":"i1","output_index":0,"content_index":0,"delta":"\n\t"},"expected":{"ok":true}},
    {"name":"text-delta-empty", "input":{"type":"response.output_text.delta","event_id":"s_empty","response_id":"r1","item_id":"i1","output_index":0,"content_index":0,"delta":""},"expected":{"ok":true}},
    {"name":"transcript-delta-space", "input":{"type":"response.output_audio_transcript.delta","event_id":"s_space","response_id":"r1","item_id":"i1","output_index":0,"content_index":0,"delta":" "},"expected":{"ok":true}},
    {"name":"transcript-delta-newline-tab", "input":{"type":"response.output_audio_transcript.delta","event_id":"s_ws","response_id":"r1","item_id":"i1","output_index":0,"content_index":0,"delta":"\n\t"},"expected":{"ok":true}},